{
  "$schema": "https://json-schema.org/draft/2020-12/schema",
  "$id": "https://agent-continuity-layer/schemas/v1/context-snapshot.json",
  "title": "Project Context Snapshot",
  "description": "60-second orientation artifact for fresh agents (charter primitive: context recovery). Single file a new agent can read to learn project identity, current milestone state, what's in flight, what the non-goals are, and where to read more. Mostly derived from git, CHARTER.md, docs/roadmap.md, the worker queue, and trust policy; the one operator-maintained field (next_safe_action) is sourced from core/context-pinned.json. Regenerated by scripts/context.sh --write. Doctor (M7.1+) compares source_head_sha against the current HEAD to detect staleness.",
  "type": "object",
  "required": [
    "schema_version",
    "generated_at",
    "source_head_sha",
    "identity",
    "milestone",
    "navigation",
    "non_goals",
    "work_in_flight",
    "trust",
    "recent_activity",
    "next_safe_action"
  ],
  "additionalProperties": false,
  "properties": {
    "schema_version": { "const": "1.0" },
    "generated_at": {
      "type": "string",
      "description": "ISO-8601 UTC instant when the snapshot was generated."
    },
    "source_head_sha": {
      "type": ["string", "null"],
      "description": "git rev-parse HEAD at generation time, or null if not in a git repo. M7.1 doctor compares against current HEAD to detect staleness."
    },
    "identity": { "$ref": "#/$defs/Identity" },
    "milestone": { "$ref": "#/$defs/Milestone" },
    "navigation": { "$ref": "#/$defs/Navigation" },
    "non_goals": {
      "type": "array",
      "description": "Verbatim bullets parsed from CHARTER.md's Non-Goals section. Quoted, not summarized.",
      "items": { "type": "string" }
    },
    "work_in_flight": { "$ref": "#/$defs/WorkInFlight" },
    "trust": { "$ref": "#/$defs/Trust" },
    "recent_activity": {
      "type": "array",
      "description": "Last N commits with milestone-tag and primitive inferred from the subject. Inference is best-effort; commits without an M-tag report milestone=null/primitive=null.",
      "items": { "$ref": "#/$defs/Commit" }
    },
    "next_safe_action": {
      "type": "string",
      "description": "Operator-maintained one-liner: the single action a fresh agent could safely take right now without re-asking. Sourced from core/context-pinned.json; empty string if unpinned."
    }
  },
  "$defs": {
    "Identity": {
      "type": "object",
      "required": ["name", "charter_one_line", "repo_path", "branch"],
      "additionalProperties": false,
      "properties": {
        "name": { "type": "string" },
        "charter_one_line": {
          "type": "string",
          "description": "First non-empty line of CHARTER.md's Primary Goal section."
        },
        "repo_path": { "type": "string" },
        "branch": { "type": "string" }
      }
    },
    "Milestone": {
      "type": "object",
      "required": [
        "last_completed",
        "last_completed_primitive",
        "next_major_milestone",
        "milestone_rule"
      ],
      "additionalProperties": false,
      "properties": {
        "last_completed": {
          "type": ["string", "null"],
          "description": "Highest M-tag found in git log subjects (e.g. 'M6.2'). null if no tagged commits."
        },
        "last_completed_primitive": {
          "type": ["string", "null"],
          "description": "Charter primitive inferred from milestone-major mapping (e.g. M6 -> 'context recovery'). null if not inferrable."
        },
        "next_major_milestone": { "$ref": "#/$defs/NextMajorMilestone" },
        "milestone_rule": {
          "type": "string",
          "description": "Short summary of the charter milestone rule, glossed for snapshot brevity."
        }
      }
    },
    "NextMajorMilestone": {
      "type": "object",
      "description": "Next *major* roadmap milestone (e.g. M8) beyond the last completed's major. By design the roadmap tracks majors only; the operator's slice-level intent for the immediate next step lives in next_safe_action (sourced from core/context-pinned.json). M7.0 originally named this 'next_proposed' and elided that distinction, which made the snapshot lie when work was in the middle of a major (e.g. after M7.0 it pointed to M8 while the actual next step was M7.1). M7.0.1 renamed the field to make the semantics honest.",
      "required": ["present", "tag", "label"],
      "additionalProperties": false,
      "properties": {
        "present": {
          "type": "boolean",
          "description": "True if a later major was found in docs/roadmap.md."
        },
        "tag": { "type": "string" },
        "label": { "type": "string" }
      }
    },
    "Navigation": {
      "type": "object",
      "required": [
        "charter",
        "roadmap",
        "architecture",
        "handoff_vs_continuity",
        "milestone_template"
      ],
      "additionalProperties": false,
      "properties": {
        "charter": { "type": "string" },
        "roadmap": { "type": "string" },
        "architecture": { "type": "string" },
        "handoff_vs_continuity": { "type": "string" },
        "milestone_template": { "type": "string" }
      }
    },
    "WorkInFlight": {
      "type": "object",
      "required": ["queue_present", "queue_counts", "open_tasks"],
      "additionalProperties": false,
      "properties": {
        "queue_present": {
          "type": "boolean",
          "description": "False if ~/.cache/agent-continuity/queue/ does not exist on this host."
        },
        "queue_counts": {
          "type": "object",
          "description": "Count per state directory. Keys are state names (queued, claimed, running, awaiting-approval, completed, rejected, failed, cancelled); values are non-negative integers. Schema does not pin keys so new states added in _worker.py do not require schema bumps.",
          "additionalProperties": { "type": "integer", "minimum": 0 }
        },
        "open_tasks": {
          "type": "object",
          "description": "Task IDs (filename stems) per open state. Keys are state names from OPEN_STATES; values are arrays of task-id strings. Terminal states (completed/rejected/failed/cancelled) are not listed here.",
          "additionalProperties": {
            "type": "array",
            "items": { "type": "string" }
          }
        }
      }
    },
    "Trust": {
      "type": "object",
      "required": [
        "policy_present",
        "grants_count",
        "default_policy_summary",
        "soonest_expiry"
      ],
      "additionalProperties": false,
      "properties": {
        "policy_present": { "type": "boolean" },
        "grants_count": { "type": "integer", "minimum": 0 },
        "default_policy_summary": {
          "type": "string",
          "description": "Human-readable one-line gloss of the default policy (e.g. 'default denies all', 'default allows 2 kind(s): code-write, read-only')."
        },
        "soonest_expiry": {
          "type": ["string", "null"],
          "description": "ISO-8601 timestamp of the earliest-expiring grant, or null if no grant has expires_at."
        }
      }
    },
    "Commit": {
      "type": "object",
      "required": ["sha", "subject", "milestone", "primitive"],
      "additionalProperties": false,
      "properties": {
        "sha": { "type": "string" },
        "subject": { "type": "string" },
        "milestone": {
          "type": ["string", "null"],
          "description": "Inferred M-tag (e.g. 'M6.2') or null if the subject has no recognizable tag."
        },
        "primitive": {
          "type": ["string", "null"],
          "description": "Charter primitive inferred from the milestone major, or null."
        }
      }
    }
  }
}
