{
  "schema_version": "1.0",
  "generated_at": "2026-05-28T02:02:38Z",
  "source_head_sha": "15653022ac58e5d66d87b27f0255d91067a39285",
  "identity": {
    "name": "agent-continuity-layer",
    "charter_one_line": "Durable continuity for AI agents across sessions, tools, devices, and model providers.",
    "repo_path": "~/.openclaw/workspace/agent-continuity-layer",
    "branch": "main"
  },
  "milestone": {
    "last_completed": null,
    "last_completed_primitive": null,
    "next_major_milestone": {
      "present": false,
      "tag": "",
      "label": ""
    },
    "milestone_rule": "Every milestone must strengthen at least one charter continuity primitive; delegation-only work belongs in adapters."
  },
  "navigation": {
    "charter": "CHARTER.md",
    "roadmap": "docs/roadmap.md",
    "architecture": "docs/architecture.md",
    "handoff_vs_continuity": "docs/handoff-vs-continuity.md",
    "milestone_template": "docs/milestone-template.md"
  },
  "non_goals": [
    "This is not only an OpenClaw plugin.",
    "This is not only a worker queue.",
    "This is not an autonomous-agent runner.",
    "This does not make the VM a config authority.",
    "This does not give agents broad write authority without trust policy and audit."
  ],
  "work_in_flight": {
    "queue_present": true,
    "queue_counts": {
      "queued": 0,
      "claimed": 0,
      "running": 0,
      "awaiting-approval": 0,
      "completed": 1,
      "rejected": 1,
      "failed": 0,
      "cancelled": 0
    },
    "open_tasks": {
      "queued": [],
      "claimed": [],
      "running": [],
      "awaiting-approval": []
    }
  },
  "trust": {
    "policy_present": true,
    "grants_count": 1,
    "default_policy_summary": "default allows 4 kind(s): code-review, data-extraction, explain, research",
    "soonest_expiry": "2026-06-01T23:59:59Z"
  },
  "recent_activity": [
    {
      "sha": "1565302",
      "subject": "chore: initialize sanitized public history",
      "milestone": null,
      "primitive": null
    }
  ],
  "next_safe_action": "bootstrap.sh gained the --connect-all opt-in flag. Adoption story now has two clean variants: one command for install + wire (curl \u2026 | bash -s -- --connect-all), or default two-step for users who want explicit consent on third-party config writes. The default stays conservative so a plain curl-pipe never touches Claude Desktop / Cursor / Zed configs without the operator typing the flag. README and docs/install.md updated to show both paths. Bumping to v0.1.6 because public install UX changed. After release, next active arc choices remain: M14.1 cross-project queries, or M14.2 per-project context pin (schema bump candidate). Out of scope still: release signing, multi-tenant trust, cryptographic identity."
}
